{
  "schemaVersion": 1,
  "hubId": "rosary",
  "lang": "es",
  "contentVersion": 10,
  "translationStatus": "MACHINE_DRAFT",
  "strings": {
    "rosary.title": "Santo rosario",
    "rosary.landing.subtitle": "Reza los misterios con una guía cuenta a cuenta.",
    "rosary.landing.diagram_description": "Un rosario completo: crucifijo, cuentas iniciales, pieza central y cinco decenas.",
    "rosary.start": "Empezar el rosario",
    "rosary.back": "Atrás",
    "rosary.resume.title": "Continúa tu rosario",
    "rosary.resume.progress": "Misterios {set} · oración {step}",
    "rosary.resume.action": "Reanudar",
    "rosary.meter.title": "Tus rosarios",
    "rosary.meter.total": "Completados",
    "rosary.meter.this_month": "Este mes",
    "rosary.mystery.joyful": "Gozosos",
    "rosary.mystery.sorrowful": "Dolorosos",
    "rosary.mystery.glorious": "Gloriosos",
    "rosary.mystery.luminous": "Luminosos",
    "rosary.mysteries.title": "Elegir misterios",
    "rosary.mysteries.intro": "Reza una serie o explora sus momentos del Evangelio.",
    "rosary.mysteries.set.joyful": "Los misterios gozosos",
    "rosary.mysteries.set.sorrowful": "Los misterios dolorosos",
    "rosary.mysteries.set.glorious": "Los misterios gloriosos",
    "rosary.mysteries.set.luminous": "Los misterios luminosos",
    "rosary.mysteries.days.joyful": "Lunes y sábado",
    "rosary.mysteries.days.sorrowful": "Martes y viernes",
    "rosary.mysteries.days.glorious": "Miércoles y domingo",
    "rosary.mysteries.days.luminous": "Jueves",
    "rosary.mysteries.fruit": "Fruto: {fruit}",
    "rosary.mystery_dialog.title": "Elige los misterios",
    "rosary.mystery_dialog.message": "Está seleccionada la serie de hoy. Puedes elegir cualquier serie.",
    "rosary.mystery_dialog.today": "Hoy",
    "rosary.mystery_dialog.cancel": "Cancelar",
    "rosary.mystery_dialog.begin": "Empezar",
    "rosary.praying.close": "Cerrar",
    "rosary.praying.progress": "Oración {current} de {total}",
    "rosary.praying.decade": "Decena {ordinal}",
    "rosary.praying.decade_progress": "Decena {ordinal} · oración {current} de {total}",
    "rosary.praying.tap_hint": "Continuar con la oración siguiente",
    "rosary.praying.back_hint": "Volver a la oración anterior",
    "rosary.praying.text_unavailable": "El texto de esta oración aún no está disponible.",
    "rosary.praying.mystery_fruit": "Fruto: {fruit}",
    "rosary.praying.carousel_description": "Cuentas del rosario desplazables. Desplázate para pasar a otra cuenta.",
    "rosary.praying.bead.cross": "Cruz",
    "rosary.praying.bead.our_father": "Cuenta del padrenuestro",
    "rosary.praying.bead.hail_mary": "Cuenta del avemaría",
    "rosary.praying.bead.centerpiece": "Pieza central",
    "rosary.meter.recent": "Últimos días",
    "rosary.meter.breakdown": "Por serie de misterios",
    "rosary.meter.day_description": "{date}: {count} rosarios completados",
    "rosary.mysteries.details": "Ver los misterios",
    "rosary.mysteries.hide_details": "Ocultar los misterios",
    "rosary.praying.next": "Siguiente oración",
    "rosary.praying.previous": "Anterior",
    "rosary.praying.finish": "Terminar el Rosario",
    "rosary.praying.swipe_hint": "Desliza el Rosario para cambiar de cuenta.",
    "rosary.praying.loading": "Cargando oración…",
    "rosary.praying.view_rosary": "Ver Rosario",
    "rosary.praying.shared_bead": "Oración {current} de {total} en esta cuenta",
    "rosary.praying.bead_progress": "Cuenta {current} de {total}",
    "rosary.landing.heading": "Un momento\npara rezar.",
    "rosary.landing.hint": "Sigue cada cuenta.",
    "rosary.landing.resume": "Retomar mi oración",
    "rosary.overview.current_prayer": "Oración actual",
    "rosary.overview.return_to_prayer": "Volver a la oración",
    "rosary.journal.title": "Diario de oración",
    "rosary.journal.previous_week": "Semana anterior",
    "rosary.journal.next_week": "Semana siguiente",
    "rosary.journal.empty_week": "No hay rosarios completados esta semana",
    "rosary.journal.no_other_completions": "No hay más rosarios completados esta semana",
    "rosary.journal.rosary_singular": "rosario",
    "rosary.journal.rosary_plural": "rosarios",
    "rosary.journal.mysteries": "Misterios {set}",
    "rosary.journal.completed": "Rosarios completados",
    "rosary.journal.date": "{weekday}, {day} de {month}",
    "rosary.journal.rosary_few": "rosarios",
    "rosary.journal.month.1": "enero",
    "rosary.journal.month.2": "febrero",
    "rosary.journal.month.3": "marzo",
    "rosary.journal.month.4": "abril",
    "rosary.journal.month.5": "mayo",
    "rosary.journal.month.6": "junio",
    "rosary.journal.month.7": "julio",
    "rosary.journal.month.8": "agosto",
    "rosary.journal.month.9": "septiembre",
    "rosary.journal.month.10": "octubre",
    "rosary.journal.month.11": "noviembre",
    "rosary.journal.month.12": "diciembre",
    "rosary.journal.weekday.0": "lunes",
    "rosary.journal.weekday.1": "martes",
    "rosary.journal.weekday.2": "miércoles",
    "rosary.journal.weekday.3": "jueves",
    "rosary.journal.weekday.4": "viernes",
    "rosary.journal.weekday.5": "sábado",
    "rosary.journal.weekday.6": "domingo",
    "rosary.journal.weekday_short.0": "lun",
    "rosary.journal.weekday_short.1": "mar",
    "rosary.journal.weekday_short.2": "mié",
    "rosary.journal.weekday_short.3": "jue",
    "rosary.journal.weekday_short.4": "vie",
    "rosary.journal.weekday_short.5": "sáb",
    "rosary.journal.weekday_short.6": "dom"
  }
}
