{
  "schemaVersion": 1,
  "hubId": "rosary",
  "lang": "pt",
  "contentVersion": 10,
  "translationStatus": "MACHINE_DRAFT",
  "strings": {
    "rosary.title": "Santo Rosário",
    "rosary.landing.subtitle": "Reze os mistérios com um guia conta por conta.",
    "rosary.landing.diagram_description": "Um rosário completo: crucifixo, contas do pingente, entremeio e cinco dezenas.",
    "rosary.start": "Começar o rosário",
    "rosary.back": "Voltar",
    "rosary.resume.title": "Continue seu rosário",
    "rosary.resume.progress": "Mistérios {set} · oração {step}",
    "rosary.resume.action": "Retomar",
    "rosary.meter.title": "Seus rosários",
    "rosary.meter.total": "Concluídos",
    "rosary.meter.this_month": "Este mês",
    "rosary.mystery.joyful": "Gozosos",
    "rosary.mystery.sorrowful": "Dolorosos",
    "rosary.mystery.glorious": "Gloriosos",
    "rosary.mystery.luminous": "Luminosos",
    "rosary.mysteries.title": "Escolher mistérios",
    "rosary.mysteries.intro": "Reze uma série ou explore os seus momentos do Evangelho.",
    "rosary.mysteries.set.joyful": "Os Mistérios Gozosos",
    "rosary.mysteries.set.sorrowful": "Os Mistérios Dolorosos",
    "rosary.mysteries.set.glorious": "Os Mistérios Gloriosos",
    "rosary.mysteries.set.luminous": "Os Mistérios Luminosos",
    "rosary.mysteries.days.joyful": "Segunda e sábado",
    "rosary.mysteries.days.sorrowful": "Terça e sexta",
    "rosary.mysteries.days.glorious": "Quarta e domingo",
    "rosary.mysteries.days.luminous": "Quinta",
    "rosary.mysteries.fruit": "Fruto: {fruit}",
    "rosary.mystery_dialog.title": "Escolha os mistérios",
    "rosary.mystery_dialog.message": "O grupo de hoje está selecionado. Você pode escolher qualquer grupo.",
    "rosary.mystery_dialog.today": "Hoje",
    "rosary.mystery_dialog.cancel": "Cancelar",
    "rosary.mystery_dialog.begin": "Começar",
    "rosary.praying.close": "Fechar",
    "rosary.praying.progress": "Oração {current} de {total}",
    "rosary.praying.decade": "{ordinal} dezena",
    "rosary.praying.decade_progress": "{ordinal} dezena · oração {current} de {total}",
    "rosary.praying.tap_hint": "Continuar para a próxima oração",
    "rosary.praying.back_hint": "Voltar à oração anterior",
    "rosary.praying.text_unavailable": "O texto desta oração ainda não está disponível.",
    "rosary.praying.mystery_fruit": "Fruto: {fruit}",
    "rosary.praying.carousel_description": "Contas do rosário roláveis. Role para passar a outra conta.",
    "rosary.praying.bead.cross": "Cruz",
    "rosary.praying.bead.our_father": "Conta do Pai-Nosso",
    "rosary.praying.bead.hail_mary": "Conta da Ave-Maria",
    "rosary.praying.bead.centerpiece": "Entremeio",
    "rosary.meter.recent": "Dias recentes",
    "rosary.meter.breakdown": "Por grupo de mistérios",
    "rosary.meter.day_description": "{date}: {count} rosários concluídos",
    "rosary.mysteries.details": "Ver os mistérios",
    "rosary.mysteries.hide_details": "Ocultar os mistérios",
    "rosary.praying.next": "Próxima oração",
    "rosary.praying.previous": "Anterior",
    "rosary.praying.finish": "Concluir o Rosário",
    "rosary.praying.swipe_hint": "Deslize o Rosário para mudar de conta.",
    "rosary.praying.loading": "A carregar a oração…",
    "rosary.praying.view_rosary": "Ver Rosário",
    "rosary.praying.shared_bead": "Oração {current} de {total} nesta conta",
    "rosary.praying.bead_progress": "Conta {current} de {total}",
    "rosary.landing.heading": "Um momento\npara rezar.",
    "rosary.landing.hint": "Acompanhe cada conta.",
    "rosary.landing.resume": "Retomar minha oração",
    "rosary.overview.current_prayer": "Oração atual",
    "rosary.overview.return_to_prayer": "Voltar à oração",
    "rosary.journal.title": "Diário de oração",
    "rosary.journal.previous_week": "Semana anterior",
    "rosary.journal.next_week": "Semana seguinte",
    "rosary.journal.empty_week": "Nenhum rosário concluído esta semana",
    "rosary.journal.no_other_completions": "Nenhum outro rosário concluído esta semana",
    "rosary.journal.rosary_singular": "rosário",
    "rosary.journal.rosary_plural": "rosários",
    "rosary.journal.mysteries": "Mistérios {set}",
    "rosary.journal.completed": "Rosários concluídos",
    "rosary.journal.date": "{weekday}, {day} de {month}",
    "rosary.journal.rosary_few": "rosários",
    "rosary.journal.month.1": "janeiro",
    "rosary.journal.month.2": "fevereiro",
    "rosary.journal.month.3": "março",
    "rosary.journal.month.4": "abril",
    "rosary.journal.month.5": "maio",
    "rosary.journal.month.6": "junho",
    "rosary.journal.month.7": "julho",
    "rosary.journal.month.8": "agosto",
    "rosary.journal.month.9": "setembro",
    "rosary.journal.month.10": "outubro",
    "rosary.journal.month.11": "novembro",
    "rosary.journal.month.12": "dezembro",
    "rosary.journal.weekday.0": "segunda-feira",
    "rosary.journal.weekday.1": "terça-feira",
    "rosary.journal.weekday.2": "quarta-feira",
    "rosary.journal.weekday.3": "quinta-feira",
    "rosary.journal.weekday.4": "sexta-feira",
    "rosary.journal.weekday.5": "sábado",
    "rosary.journal.weekday.6": "domingo",
    "rosary.journal.weekday_short.0": "seg",
    "rosary.journal.weekday_short.1": "ter",
    "rosary.journal.weekday_short.2": "qua",
    "rosary.journal.weekday_short.3": "qui",
    "rosary.journal.weekday_short.4": "sex",
    "rosary.journal.weekday_short.5": "sáb",
    "rosary.journal.weekday_short.6": "dom"
  }
}
