{
  "schemaVersion": 1,
  "hubId": "rosary",
  "lang": "pl",
  "contentVersion": 10,
  "translationStatus": "MACHINE_DRAFT",
  "strings": {
    "rosary.title": "Różaniec Święty",
    "rosary.landing.subtitle": "Odmawiaj tajemnice z przewodnikiem paciorek po paciorku.",
    "rosary.landing.diagram_description": "Cały różaniec: krzyżyk, paciorki wiszące, łącznik i pięć dziesiątek.",
    "rosary.start": "Rozpocznij różaniec",
    "rosary.back": "Wstecz",
    "rosary.resume.title": "Kontynuuj różaniec",
    "rosary.resume.progress": "Tajemnice {set} · modlitwa {step}",
    "rosary.resume.action": "Wznów",
    "rosary.meter.title": "Twoje różańce",
    "rosary.meter.total": "Ukończone",
    "rosary.meter.this_month": "W tym miesiącu",
    "rosary.mystery.joyful": "Radosne",
    "rosary.mystery.sorrowful": "Bolesne",
    "rosary.mystery.glorious": "Chwalebne",
    "rosary.mystery.luminous": "Światła",
    "rosary.mysteries.title": "Wybierz tajemnice",
    "rosary.mysteries.intro": "Módl się wybraną częścią lub poznaj jej wydarzenia ewangeliczne.",
    "rosary.mysteries.set.joyful": "Tajemnice radosne",
    "rosary.mysteries.set.sorrowful": "Tajemnice bolesne",
    "rosary.mysteries.set.glorious": "Tajemnice chwalebne",
    "rosary.mysteries.set.luminous": "Tajemnice światła",
    "rosary.mysteries.days.joyful": "Poniedziałek i sobota",
    "rosary.mysteries.days.sorrowful": "Wtorek i piątek",
    "rosary.mysteries.days.glorious": "Środa i niedziela",
    "rosary.mysteries.days.luminous": "Czwartek",
    "rosary.mysteries.fruit": "Owoc: {fruit}",
    "rosary.mystery_dialog.title": "Wybierz tajemnice",
    "rosary.mystery_dialog.message": "Wybrano dzisiejszą część. Możesz wybrać dowolną część.",
    "rosary.mystery_dialog.today": "Dzisiaj",
    "rosary.mystery_dialog.cancel": "Anuluj",
    "rosary.mystery_dialog.begin": "Rozpocznij",
    "rosary.praying.close": "Zamknij",
    "rosary.praying.progress": "Modlitwa {current} z {total}",
    "rosary.praying.decade": "Dziesiątka {ordinal}",
    "rosary.praying.decade_progress": "Dziesiątka {ordinal} · modlitwa {current} z {total}",
    "rosary.praying.tap_hint": "Przejdź do następnej modlitwy",
    "rosary.praying.back_hint": "Wróć do poprzedniej modlitwy",
    "rosary.praying.text_unavailable": "Tekst tej modlitwy nie jest jeszcze dostępny.",
    "rosary.praying.mystery_fruit": "Owoc: {fruit}",
    "rosary.praying.carousel_description": "Przewijane paciorki różańca. Przewiń, aby przejść do innego paciorka.",
    "rosary.praying.bead.cross": "Krzyżyk",
    "rosary.praying.bead.our_father": "Paciorek Ojcze nasz",
    "rosary.praying.bead.hail_mary": "Paciorek Zdrowaś Maryjo",
    "rosary.praying.bead.centerpiece": "Łącznik",
    "rosary.meter.recent": "Ostatnie dni",
    "rosary.meter.breakdown": "Według części tajemnic",
    "rosary.meter.day_description": "{date}: ukończone różańce: {count}",
    "rosary.mysteries.details": "Zobacz tajemnice",
    "rosary.mysteries.hide_details": "Ukryj tajemnice",
    "rosary.praying.next": "Następna modlitwa",
    "rosary.praying.previous": "Wstecz",
    "rosary.praying.finish": "Zakończ różaniec",
    "rosary.praying.swipe_hint": "Przesuń różaniec, aby zmienić paciorek.",
    "rosary.praying.loading": "Ładowanie modlitwy…",
    "rosary.praying.view_rosary": "Zobacz różaniec",
    "rosary.praying.shared_bead": "Modlitwa {current} z {total} na tym paciorku",
    "rosary.praying.bead_progress": "Paciorek {current} z {total}",
    "rosary.landing.heading": "Chwila\nna modlitwę.",
    "rosary.landing.hint": "Podążaj za paciorkami.",
    "rosary.landing.resume": "Wznów moją modlitwę",
    "rosary.overview.current_prayer": "Obecna modlitwa",
    "rosary.overview.return_to_prayer": "Wróć do modlitwy",
    "rosary.journal.title": "Dziennik modlitwy",
    "rosary.journal.previous_week": "Poprzedni tydzień",
    "rosary.journal.next_week": "Następny tydzień",
    "rosary.journal.empty_week": "Brak ukończonych różańców w tym tygodniu",
    "rosary.journal.no_other_completions": "Brak innych ukończonych różańców w tym tygodniu",
    "rosary.journal.rosary_singular": "różaniec",
    "rosary.journal.rosary_plural": "różańców",
    "rosary.journal.mysteries": "Tajemnice: {set}",
    "rosary.journal.completed": "Ukończone różańce",
    "rosary.journal.date": "{weekday}, {day} {month}",
    "rosary.journal.rosary_few": "różańce",
    "rosary.journal.month.1": "stycznia",
    "rosary.journal.month.2": "lutego",
    "rosary.journal.month.3": "marca",
    "rosary.journal.month.4": "kwietnia",
    "rosary.journal.month.5": "maja",
    "rosary.journal.month.6": "czerwca",
    "rosary.journal.month.7": "lipca",
    "rosary.journal.month.8": "sierpnia",
    "rosary.journal.month.9": "września",
    "rosary.journal.month.10": "października",
    "rosary.journal.month.11": "listopada",
    "rosary.journal.month.12": "grudnia",
    "rosary.journal.weekday.0": "poniedziałek",
    "rosary.journal.weekday.1": "wtorek",
    "rosary.journal.weekday.2": "środa",
    "rosary.journal.weekday.3": "czwartek",
    "rosary.journal.weekday.4": "piątek",
    "rosary.journal.weekday.5": "sobota",
    "rosary.journal.weekday.6": "niedziela",
    "rosary.journal.weekday_short.0": "pon",
    "rosary.journal.weekday_short.1": "wt",
    "rosary.journal.weekday_short.2": "śr",
    "rosary.journal.weekday_short.3": "czw",
    "rosary.journal.weekday_short.4": "pt",
    "rosary.journal.weekday_short.5": "sob",
    "rosary.journal.weekday_short.6": "nd"
  }
}
